{"candidate":{"contentDigest":"sha256:905c5ed5738fae782690b587e5c41415ffd652e99ab4d578a30d899978b6c5c2","path":"artifacts/candidate-4f399a3b2b2261effababc734423359db8eaf2909a9f8faf701e3de5228b103e.sqlite","sizeBytes":15},"checks":{"candidate":{"foreignKeyCheck":"ok","integrityCheck":"ok","schemaContractCheck":"ok","sidecarCheck":"ok"},"rollback":{"foreignKeyCheck":"ok","integrityCheck":"ok","schemaContractCheck":"ok","sidecarCheck":"ok"}},"createdAt":"2026-07-14T12:00:01.000Z","databaseIdentity":"com.asf.shikin:shikin.db","fencingGeneration":17,"nonce":"000102030405060708090a0b0c0d0e0f101112131415161718191a1b1c1d1e1f","operation":"restore","operationId":"restore-😀-","owner":{"hostId":"host-\"/\\-\b\t\n\f\r-\u0001-  ","ownerId":"owner--😀","processId":4242,"processStartedAt":"2026-07-14T12:00:00.000Z","runtimeId":"cli"},"previousRecordSha256":null,"protocol":"shikin.database-operation-recovery-journal","protocolVersion":1,"recordKind":"prepared_mutation","rollback":{"contentDigest":"sha256:5f9feb50193adfecfb27fa16009e1b7fbfb90c033846388aafbc1fd78cab6fe5","path":"artifacts/rollback-19be901054c5d1a673933d1fcb872cb9a10e209402a91253fe8de33fc59016e4.sqlite","sizeBytes":7},"schemaContract":{"contractVersion":1,"latestMigration":"019_financial_semantics","rawBytesSha256":"sha256:9c6269cac2ec752914a6ef9178c8b6ab2e9fbbe7db15b5deaf9aaf1e7b829056"},"sequence":0}
